{
  "$schema": "./schema.json",
  "version": 1,
  "name": "invention-machine-first-use",
  "description": "Ready to exercise the Invention Machine's first-use path.",
  "checkpoint": "after-mayor",
  "map": "home-r-and-d",
  "position": {
    "x": 128,
    "y": 144,
    "direction": "up"
  },
  "flags": {
    "robotBookRead": true,
    "nagisaIntroducedMachine": true,
    "machineUsed": false
  }
}
